software,reference,group,score,scoreN,score1,score1N,score2,score2N,score3,score3N,score4,score4N,score5,score5N,1_2_3,1_3_1,1_3,1_5_1,1_5_2,1_6_1,1_6_2,2_1,2_2,2_3,2_4,3_1_1,3_1_2,3_1_3,3_1_4,3_1_5_1,3_1_5_2,3_1_5_3,3_1_5_4,3_2_1,3_2_2,3_2_3,3_2_4,4_1,4_2,4_3_1,4_3_2,4_3_3,4_3_4,4_3_5,5_1,5_2_1,5_2_2,5_2_3,5_2_4,5_3_1,5_3_2,5_3_3,5_4_1,5_4_2,description,link
SAFIR,,F1,1,1,,,,,,,,,,,,,,,,,,,,,,,,,,,,,,,,,,,,,,,,,,,,,,,,,,,"The program allows loading of individual protein monomers or oligomeric structures which can be displayed and oriented as rigid bodies in a molecular graphics viewer. A shape object restored from small-angle scattering data can also be displayed, enabling the user to arrange the protein molecules to fit. For the loaded model, the small-angle scattering can be evaluated and compared to experimental scattering data.Rigid body refinement of the loaded model has been implemented by means of a Monte-Carlo approach which uses the fit between model-derived and experimental scattering data as target function.",http://www.iucr.org/resources/other-directories/software/safir
SImPA,,F1,1,1,,,,,,,,,,,,,,,,,,,,,,,,,,,,,,,,,,,,,,,,,,,,,,,,,,,"SImPA(Simplified Imaging Plate Analysis / version 1.3) provides the necessary tools to process a powder X-ray diffraction image recorded on a phosphor imaging plate for further analysis as follows: (1) Image display and manipulation, e.g. pixel intensity readout, image enhancement and enlargement; (2) Sample-to-plate distance calibration for the analysis of the X-ray diffraction image; (3) Imaging plate orientation correction; (4) Removal of spurious high intensity spots (e.g. Bragg spots from large single grains); (5) Azimuthal summation of pixel intensities for the construction of a high signal-to-background intensity profile as a function of the diffraction angle. SImPA offers an easy-to-use interface. A working version of SImPA (version 1.3) is available free of charge for evaluation.  Contact Serge Desgreniers (sdesgren@uOttawa.ca) for further information.",http://www.iucr.org/resources/other-directories/software/simpa
SIMPRO,,F1,1,1,,,,,,,,,,,,,,,,,,,,,,,,,,,,,,,,,,,,,,,,,,,,,,,,,,,"Full Powder Pattern Fitting Program. Refinement of multible phases, of the wave vector components of a modulated structures, Lorentz polarisation...",http://www.iucr.org/resources/other-directories/software/simpro
SIMREF,,F1,1,1,,,,,,,,,,,,,,,,,,,,,,,,,,,,,,,,,,,,,,,,,,,,,,,,,,,Simultaneous Rietveld Refinement with Multible Powder Datasets.,http://www.iucr.org/resources/other-directories/software/simref
SP2,,F1,1,1,,,,,,,,,,,,,,,,,,,,,,,,,,,,,,,,,,,,,,,,,,,,,,,,,,,A computer program for plotting stereographic projection and exploring crystallographic orientation relationships.,http://www.iucr.org/resources/other-directories/software/sp2
STOE IPDS,,F1,1,1,,,,,,,,,,,,,,,,,,,,,,,,,,,,,,,,,,,,,,,,,,,,,,,,,,,"Collection of software, from STOE, for measuring and evaluating intensities of twinned or grown-together crystals on the IPDS. Collection of images, multi-frames search, graphical representation, output (ShelX format)",http://www.iucr.org/resources/other-directories/software/stoe-ipds
STR3DI,,F1,1,1,,,,,,,,,,,,,,,,,,,,,,,,,,,,,,,,,,,,,,,,,,,,,,,,,,,"Molecular modeller for organic chemists. Allows measure of every geometric parameter, examination of each atom, bond, bond length, bond angle, torsional angle, and their accompanying stereo-electronic effects, in any organic molecule.",http://www.iucr.org/resources/other-directories/software/str3di
StressTextureCalculator,,F1,1,1,,,,,,,,,,,,,,,,,,,,,,,,,,,,,,,,,,,,,,,,,,,,,,,,,,,"StressTextureCalculator (STeCa) is designed to facilitate fast, easy and automated access to area-detector data. Its outstanding features are direct calculation of diffraction patterns from different types of area-detector measurements, automatic data treatment and peak fitting using several implemented fit options. Software is available on request from the author.",http://www.iucr.org/resources/other-directories/software/stresstexturecalculator
Symmet,,F1,1,1,,,,,,,,,,,,,,,,,,,,,,,,,,,,,,,,,,,,,,,,,,,,,,,,,,,For the routine analysis of crystallographic texture by neutron diffraction at Chalk River Laboratories.,http://www.iucr.org/resources/other-directories/software/symmet
TechDig,,F1,1,1,,,,,,,,,,,,,,,,,,,,,,,,,,,,,,,,,,,,,,,,,,,,,,,,,,,Tool for digitizing data from an image of graph or plot from Ron Jones.,http://www.iucr.org/resources/other-directories/software/techdig
TEMStrain,,F1,1,1,,,,,,,,,,,,,,,,,,,,,,,,,,,,,,,,,,,,,,,,,,,,,,,,,,,"A package for analysis of convergent beam electron diffraction (CBED) patterns; in particular, for refinement of lattice parameters based on multiple CBED patterns.",http://www.iucr.org/resources/other-directories/software/temstrain
Thermo Calc,,F1,1,1,,,,,,,,,,,,,,,,,,,,,,,,,,,,,,,,,,,,,,,,,,,,,,,,,,,Software and databases for thermodynamic calculations,http://www.iucr.org/resources/other-directories/software/thermo-calc
Twiny,,F1,1,1,,,,,,,,,,,,,,,,,,,,,,,,,,,,,,,,,,,,,,,,,,,,,,,,,,,A small software to compute the angle between corresponding directions in a twinned crystal from a known twin element or vice versa.,http://www.iucr.org/resources/other-directories/software/twiny
UWXAFS,,F1,1,1,,,,,,,,,,,,,,,,,,,,,,,,,,,,,,,,,,,,,,,,,,,,,,,,,,,Package for X-ray Absorption Fine Structure (XAFS),http://www.iucr.org/resources/other-directories/software/uwxafs
Valmap,,F1,1,1,,,,,,,,,,,,,,,,,,,,,,,,,,,,,,,,,,,,,,,,,,,,,,,,,,,"A program for calculations and visualizations of contour maps of Bond Valence Sum. Version 2.1Brown, I.D. (1992). <i>Acta Cryst.</i> B<b>48</b>, 553â€“572.   Waltersson, K. (1978). <i>Acta Cryst.</i> A<b>34</b>, 901â€“905.",http://www.iucr.org/resources/other-directories/software/valmap
VEC-B,,F1,1,1,,,,,,,,,,,,,,,,,,,,,,,,,,,,,,,,,,,,,,,,,,,,,,,,,,,"Package for visual computing in electron crystallography. Includes: Preliminary processing of electron microscope images, Indexing and measurement of electron difffraction patterns, Determination of the defocus value from a single electron microscope image, Direct-method resolution enhancement of electron microscope images, Simulation of dynamical/kinematical electron diffraction patterns and electron microscope images, 2-, 3- and 4-dimensional FFT, 2-dimensional half-tone-graph, display of 2-, 3- and 4-dimensional Fourier maps Contour mapping of 2-dimensional patterns, Automatic determination of atomic modulation curves in an incommensurate modulated structure",http://www.iucr.org/resources/other-directories/software/vec-b
VRML guide,,F1,1,1,,,,,,,,,,,,,,,,,,,,,,,,,,,,,,,,,,,,,,,,,,,,,,,,,,,"Reference guide about VRML and software using this language from the ""Guide to Internet Tools and Resources"" established by the IUCr",http://www.iucr.org/resources/other-directories/software/vrml-guide
VRML ILL,,F1,1,1,,,,,,,,,,,,,,,,,,,,,,,,,,,,,,,,,,,,,,,,,,,,,,,,,,,"VRML demos at ILL, France",http://www.iucr.org/resources/other-directories/software/vrml-ill
VRML ILL Visualization,,F1,1,1,,,,,,,,,,,,,,,,,,,,,,,,,,,,,,,,,,,,,,,,,,,,,,,,,,,"demonstrations of Virtual Reality Modelling Language: ILL, France",http://www.iucr.org/resources/other-directories/software/vrml-ill-visualization
VRML Imperial College Visualization,,F1,1,1,,,,,,,,,,,,,,,,,,,,,,,,,,,,,,,,,,,,,,,,,,,,,,,,,,,demonstrations of Virtual Reality Modelling Language: Imperial,http://www.iucr.org/resources/other-directories/software/vrml-imperial-college-visualization
VRML Le Mans,,F1,1,1,,,,,,,,,,,,,,,,,,,,,,,,,,,,,,,,,,,,,,,,,,,,,,,,,,,"VRML demos at Le Mans, France",http://www.iucr.org/resources/other-directories/software/vrml-le-mans
VRML University of Queensland,,F1,1,1,,,,,,,,,,,,,,,,,,,,,,,,,,,,,,,,,,,,,,,,,,,,,,,,,,,Demonstrations of Virtual Reality Modelling Language: University of Queensland.,http://www.iucr.org/resources/other-directories/software/vrml-university-of-queensland
WebCT,,F1,1,1,,,,,,,,,,,,,,,,,,,,,,,,,,,,,,,,,,,,,,,,,,,,,,,,,,,"WebCT is a tool that facilitates the creation of sophisticated World Wide Web-based educational environments. It can be used to create entire on-line courses, or to simply publish materials that supplement existing courses.",http://www.iucr.org/resources/other-directories/software/webct
WebEMAPS,,F1,1,1,,,,,,,,,,,,,,,,,,,,,,,,,,,,,,,,,,,,,,,,,,,,,,,,,,,"Web application. Simulates electron diffraction patterns and images: 1) crystal structure definition and rendering, 2) kinematic diffraction including Kikuchi and HOLZ lines, 3) Convergent beam electron diffraction by the Bloch wave method, 4) HREM image simulation by the Bloch wave method, 5) electron probe propagation and channeling, 6) structure factor and d-spacing calculations, and 7) Coherent electron diffraction. Contains a database of common crystals for materials science. Users may define their own crystals or upload a CIF file.",http://www.iucr.org/resources/other-directories/software/webemaps
Weber Java Applets,,F1,1,1,,,,,,,,,,,,,,,,,,,,,,,,,,,,,,,,,,,,,,,,,,,,,,,,,,,"A collection of Java applets for crystallography : includes calculation of stereograms, Laue diagrams, Fourier transforms of periodic &amp; quasiperiodic point sets...",http://www.iucr.org/resources/other-directories/software/weber-java-applets
WebLab Viewer,,F1,1,1,,,,,,,,,,,,,,,,,,,,,,,,,,,,,,,,,,,,,,,,,,,,,,,,,,,"Molecular graphics visualization with a full range of Windows desktop integration tools. Allows to visualize and share molecular information, build molecular models, and analyze organic and inorganic structures, proteins, DNA/RNA, and crystals. No longer available.",http://www.iucr.org/resources/other-directories/software/weblab-viewer
WillItFit,,F1,1,1,,,,,,,,,,,,,,,,,,,,,,,,,,,,,,,,,,,,,,,,,,,,,,,,,,,A software framework for simultaneous analysis of several small-angle scattering data sets by a molecular constrained modeling approach.,http://www.iucr.org/resources/other-directories/software/willitfit
WinCSD,,F1,1,1,,,,,,,,,,,,,,,,,,,,,,,,,,,,,,,,,,,,,,,,,,,,,,,,,,,"The fourth version of the program package WinCSD is multi-purpose computer software for crystallographic calculations using single-crystal and powder X-ray and neutron diffraction data. WinCSD covers the complete spectrum of crystallographic calculations, including powder diffraction pattern deconvolution, crystal structure solution and refinement in 3 + d space, reconstruction of electron density from diffraction data, and graphical representation of crystallographic information.",http://www.iucr.org/resources/other-directories/software/wincsd
WinTensor,,F1,1,1,,,,,,,,,,,,,,,,,,,,,,,,,,,,,,,,,,,,,,,,,,,,,,,,,,,Provide information as possible required for analysing anisotropic properties in crystals displayed as a 3-D image. Allows to draw cross-sections and export representation surfaces in different formats including VRML-format. Offers least-squares procedures for determining a tensor using raw data.,http://www.iucr.org/resources/other-directories/software/wintensor
Wotsit's Format,,F1,1,1,,,,,,,,,,,,,,,,,,,,,,,,,,,,,,,,,,,,,,,,,,,,,,,,,,,"This site contains information on hundreds of different file types, data types, hardware interface details and all sorts of other useful programming information; algorithms, source code, specifications, etc.",http://www.iucr.org/resources/other-directories/software/wotsits-format
Wwwtable,,F1,1,1,,,,,,,,,,,,,,,,,,,,,,,,,,,,,,,,,,,,,,,,,,,,,,,,,,,A perl script that turns simple text specifications of tables into nicely-formatted HTML.,http://www.iucr.org/resources/other-directories/software/wwwtable
XBroad,,F1,1,1,,,,,,,,,,,,,,,,,,,,,,,,,,,,,,,,,,,,,,,,,,,,,,,,,,,A public domain program designed for easy determination of basic microstructural information from powder X-ray diffraction data.,http://www.iucr.org/resources/other-directories/software/xbroad
X-Ray Diffraction Simulator,,F1,1,1,,,,,,,,,,,,,,,,,,,,,,,,,,,,,,,,,,,,,,,,,,,,,,,,,,,Provides a graphical user interface to a computer simulation of x-ray powder diffraction of two-dimensional crystals.,http://www.iucr.org/resources/other-directories/software/x-ray-diffraction-simulator
X-Ray interaction with matter,,F1,1,1,,,,,,,,,,,,,,,,,,,,,,,,,,,,,,,,,,,,,,,,,,,,,,,,,,,"A number of X-ray calculations through a web form. For instance: X-ray reflectivity, X-ray transmission.",http://www.iucr.org/resources/other-directories/software/x-ray-interaction-with-matter
XSAS-Collect,,F1,1,1,,,,,,,,,,,,,,,,,,,,,,,,,,,,,,,,,,,,,,,,,,,,,,,,,,,"Flexible user-friendly standard for XAS data acquisition. Incorporates automated features and design to facilitate a rapid experimental startup. To further assist in startup, the software has been designed to perform an XAS experiment in logical steps, starting with beamline alignment, then detector setup, file preparation, and initializing an experimental run.",http://www.iucr.org/resources/other-directories/software/xsas-collect
Xtal-3D,,F1,1,1,,,,,,,,,,,,,,,,,,,,,,,,,,,,,,,,,,,,,,,,,,,,,,,,,,,3D crystal structures in VRML from the ILL Diffraction Group.,http://www.iucr.org/resources/other-directories/software/xtal-3d
XTAL4POV,,F1,1,1,,,,,,,,,,,,,,,,,,,,,,,,,,,,,,,,,,,,,,,,,,,,,,,,,,,"Crystal shape generator by Klaus Kosten,kosten@kristall.xtal.rwth-aachen.de",http://www.iucr.org/resources/other-directories/software/xtal4pov
XtalView,,F1,1,1,,,,,,,,,,,,,,,,,,,,,,,,,,,,,,,,,,,,,,,,,,,,,,,,,,,Package for fitting electron density maps and solving structures by MIR and MAD written by Duncan McRee at Scripps.,http://www.iucr.org/resources/other-directories/software/xtalview
Yell,,F1,1,1,,,,,,,,,,,,,,,,,,,,,,,,,,,,,,,,,,,,,,,,,,,,,,,,,,,Yell is a program for analyzing diffuse scattering <i>via</i> the three-dimensional delta pair distribution function approach. The program allows flexible and efficient modeling of disorder in single crystals.,http://www.iucr.org/resources/other-directories/software/yell
2D and 3D image processing,,Z,0,0,,,,,,,,,,,,,,,,,,,,,,,,,,,,,,,,,,,,,,,,,,,,,,,,,,,2D and 3D image processing,http://www.iucr.org/resources/other-directories/software/2d-and-3d-image-processing
3D reconstruction,,Z,0,0,,,,,,,,,,,,,,,,,,,,,,,,,,,,,,,,,,,,,,,,,,,,,,,,,,,3D reconstruction home page. 3D visualization software,http://www.iucr.org/resources/other-directories/software/3d-reconstruction
3DBbrowse,,Z,0,0,,,,,,,,,,,,,,,,,,,,,,,,,,,,,,,,,,,,,,,,,,,,,,,,,,,"New web based browser, 3DBbrowse, makes it even simpler to search and retrieve data from the Protein Data Bank (PDB).",http://www.iucr.org/resources/other-directories/software/3dbbrowse
3DBVSMAPPER,,Z,0,0,,,,,,,,,,,,,,,,,,,,,,,,,,,,,,,,,,,,,,,,,,,,,,,,,,,3DBVSMAPPER is a program that generates bond-valence sum maps and bond-valence energy landscapes with a given test ion. It uses the application programming interface provided with Materials Studio. The program is available from the authors.,http://www.iucr.org/resources/other-directories/software/3dbvsmapper
ABSCYL,,Z,0,0,,,,,,,,,,,,,,,,,,,,,,,,,,,,,,,,,,,,,,,,,,,,,,,,,,,Absorption correction for cylinders (very handy for needle shaped crystals). Program by JH Reibenspies at Texas A&M.,http://www.iucr.org/resources/other-directories/software/abscyl
ABSEN,,Z,0,0,,,,,,,,,,,,,,,,,,,,,,,,,,,,,,,,,,,,,,,,,,,,,,,,,,,"Study and display of crystal structures, thermal ellipsoid plots, mouse based interactive editing of Shelx files with auto atom sort. RASTEP and RENDER have been added to the system giving realistic rendered 3D pictures from the same view as ORTEX direct from Shelx.INS files.",http://www.iucr.org/resources/other-directories/software/absen
ABSORB,,Z,0,0,,,,,,,,,,,,,,,,,,,,,,,,,,,,,,,,,,,,,,,,,,,,,,,,,,,"Brennan-Cowan X-ray absorption, reflection and dispersion calculation. Calculates f' and f'' based on theoretical work of Cromer and Liberman calculates Rayleigh and Compton cross-section based on McMaster.",http://www.iucr.org/resources/other-directories/software/absorb
ABSORB-7 and ABSORB-GUI,,Z,0,0,,,,,,,,,,,,,,,,,,,,,,,,,,,,,,,,,,,,,,,,,,,,,,,,,,,"ABSORB is a program to calculate and apply absorption corrections to single-crystal X-ray intensity data, has been reconfigured to allow it to be called directly from external data processing programs. ABSORB-GUI has been developed to allow much easier specification of standard experiments.",http://www.iucr.org/resources/other-directories/software/absorb-7-and-absorb-gui
ACNUC,,Z,0,0,,,,,,,,,,,,,,,,,,,,,,,,,,,,,,,,,,,,,,,,,,,,,,,,,,,ACNUC is a retrieval system for the nucleotide sequence databases.,http://www.iucr.org/resources/other-directories/software/acnuc
Acquisition of Images,,Z,0,0,,,,,,,,,,,,,,,,,,,,,,,,,,,,,,,,,,,,,,,,,,,,,,,,,,,Digitization software.,http://www.iucr.org/resources/other-directories/software/acquisition-of-images
ADM,,Z,0,0,,,,,,,,,,,,,,,,,,,,,,,,,,,,,,,,,,,,,,,,,,,,,,,,,,,"Solution including device control, the diffractogram evaluation, qualitative and quantitative phase analysis, indexing, lattice parameter refinement, crystal size evaluation, micro-stress analysis, profile analysis and pattern simulation.",http://www.iucr.org/resources/other-directories/software/adm
ALIGN,,Z,0,0,,,,,,,,,,,,,,,,,,,,,,,,,,,,,,,,,,,,,,,,,,,,,,,,,,,Superimposition of protein coordinates accounting for insertions and deletions.,http://www.iucr.org/resources/other-directories/software/align
Alscript,,Z,0,0,,,,,,,,,,,,,,,,,,,,,,,,,,,,,,,,,,,,,,,,,,,,,,,,,,,"Alscript is a program to format multiple sequence alignments in PostScript for publication and to assist in analysis.  Alscript does not support point-and-click, but has a scripting language to allow complex effects.",http://www.iucr.org/resources/other-directories/software/alscript
Altwyk,,Z,0,0,,,,,,,,,,,,,,,,,,,,,,,,,,,,,,,,,,,,,,,,,,,,,,,,,,,"Altwyk is a stand-alone program which produces the general position and Wyckoff positions for any space group symbol listed in <i>International Tables for Crystallography</i>, Vol. A (1983). Altwyk can currently process over 1,000 of them, probably covering all actual literature cases, but we are still implementing new odd symbols. Written by Y. Le Page and S. Raymond",http://www.iucr.org/resources/other-directories/software/altwyk
Amas,,Z,0,0,,,,,,,,,,,,,,,,,,,,,,,,,,,,,,,,,,,,,,,,,,,,,,,,,,,Automatic analysis of multiple protein sequence.,http://www.iucr.org/resources/other-directories/software/amas
AMBER,,Z,0,0,,,,,,,,,,,,,,,,,,,,,,,,,,,,,,,,,,,,,,,,,,,,,,,,,,,Assisted Model Building with Energy Refinement.,http://www.iucr.org/resources/other-directories/software/amber
Amps,,Z,0,0,,,,,,,,,,,,,,,,,,,,,,,,,,,,,,,,,,,,,,,,,,,,,,,,,,,Multiple protein sequence alignment and flexible pattern.,http://www.iucr.org/resources/other-directories/software/amps
ANAELU,,Z,0,0,,,,,,,,,,,,,,,,,,,,,,,,,,,,,,,,,,,,,,,,,,,,,,,,,,,"Software package ANAELU (analytical emulator Laue utility) has been created for aiding the interpretation of two-dimensional X-ray diffraction patterns produced by textured (bulk and nanostructured) samples. ANAELU is composed of three interconnected applications, corresponding to three crystallographic tasks: structure representation, two-dimensional pattern analysis and diffraction simulation.",http://www.iucr.org/resources/other-directories/software/anaelu
ANODE,,Z,0,0,,,,,,,,,,,,,,,,,,,,,,,,,,,,,,,,,,,,,,,,,,,,,,,,,,,"The program determines anomalous (or heavy-atom) densities by reversing the usual procedure for experimental phase determination. Instead of adding a phase shift to the heavy-atom phases to obtain a starting value for the native protein phase, this phase shift is subtracted from the native phase to obtain the heavy-atom substructure phase.",http://www.iucr.org/resources/other-directories/software/anode
ANSIG,,Z,0,0,,,,,,,,,,,,,,,,,,,,,,,,,,,,,,,,,,,,,,,,,,,,,,,,,,,Analysis of NMR spectra. Tool for analysis and assignment of multidimensional spectra.,http://www.iucr.org/resources/other-directories/software/ansig
ANTHEPROT,,Z,0,0,,,,,,,,,,,,,,,,,,,,,,,,,,,,,,,,,,,,,,,,,,,,,,,,,,,Protein analysis. Web on-line tool.,http://www.iucr.org/resources/other-directories/software/antheprot
Archive for MacOS,,Z,0,0,,,,,,,,,,,,,,,,,,,,,,,,,,,,,,,,,,,,,,,,,,,,,,,,,,,MacOs software,http://www.iucr.org/resources/other-directories/software/defunct/archive-for-macos
ARITVE,,Z,0,0,,,,,,,,,,,,,,,,,,,,,,,,,,,,,,,,,,,,,,,,,,,,,,,,,,,Modelling amorphous structures by a Rietveld-type refinement of the atomic coordinates.,http://www.iucr.org/resources/other-directories/software/aritve
ARP/wARP,,Z,0,0,,,,,,,,,,,,,,,,,,,,,,,,,,,,,,,,,,,,,,,,,,,,,,,,,,,"ARP/wARP is used for automated building and refinement of protein structures. Real space pattern recognition, refinement and model update are combined with reciprocal space refinement to construct and improve protein models. ARP/wARP can also be used for ab initio structure solution of metalloproteins at high resolution.",http://www.iucr.org/resources/other-directories/software/arpwarp
ASF88,,Z,0,0,,,,,,,,,,,,,,,,,,,,,,,,,,,,,,,,,,,,,,,,,,,,,,,,,,,For the generation and calculation of the X-ray atomic scattering factors of any atom/ion and graphical output in two formats. Exists as GUI version named asf88win.,http://www.iucr.org/resources/other-directories/software/asf88
Assp,,Z,0,0,,,,,,,,,,,,,,,,,,,,,,,,,,,,,,,,,,,,,,,,,,,,,,,,,,,"The program takes a multiple protein sequence alignment and estimates the range in accuracy that one can expect for a ""perfect"" secondary structure prediction made using the alignment.",http://www.iucr.org/resources/other-directories/software/assp
AUTO_XPL,,Z,0,0,,,,,,,,,,,,,,,,,,,,,,,,,,,,,,,,,,,,,,,,,,,,,,,,,,,Automates many of the computational steps involved in using X-PLOR.,http://www.iucr.org/resources/other-directories/software/auto_xpl
AutoDep,,Z,0,0,,,,,,,,,,,,,,,,,,,,,,,,,,,,,,,,,,,,,,,,,,,,,,,,,,,"Autodep is a tool designed for the deposition into the Protein Data Bank of molecular coordinates data generated by the experimental procedures, viz. protein crystallography, NMR, EM.",http://www.iucr.org/resources/other-directories/software/autodep
AXES,,Z,0,0,,,,,,,,,,,,,,,,,,,,,,,,,,,,,,,,,,,,,,,,,,,,,,,,,,,Program for X-ray powder diffraction data evaluation that is specially designed for peak-shape analysis and data preparation for Rietveld refinement in connection with the FULLPROF program.,http://www.iucr.org/resources/other-directories/software/axes
AZARA,,Z,0,0,,,,,,,,,,,,,,,,,,,,,,,,,,,,,,,,,,,,,,,,,,,,,,,,,,,Analysis of NMR spectra. Suite of programs for the processing of multidimensional spectra,http://www.iucr.org/resources/other-directories/software/azara
BABEL,,Z,0,0,,,,,,,,,,,,,,,,,,,,,,,,,,,,,,,,,,,,,,,,,,,,,,,,,,,Program designed to interconvert a number of file formats currently used in molecular moldeling. rpm for Linux available at ftp site.,http://www.iucr.org/resources/other-directories/software/babel
Baxmap,,C,0,0,,,,,,,,,,,,,,,,,,,,,,,,,,,,,,,,,,,,,,,,,,,,,,,,,,,"Visualisation , transformation and analysis of crystallographic coordinates. Allows for both crystallographic and non-crystallographic transformations, with such modifications as bond lengths, angles and torsions, as well as reorientations of molecules within the unit cell. Written by Ian Baxter at Imperial College.",http://www.iucr.org/resources/other-directories/software/baxmap
BayesApp,,Z,0,0,,,,,,,,,,,,,,,,,,,,,,,,,,,,,,,,,,,,,,,,,,,,,,,,,,,A web site for indirect transformation of small-angle scattering data. No user input is necessary beyond the experimental data. Results of the analysis can be downloaded from the web site in the form of ASCII files.,http://www.iucr.org/resources/other-directories/software/bayesapp
BayesApp: update,,Z,0,0,,,,,,,,,,,,,,,,,,,,,,,,,,,,,,,,,,,,,,,,,,,,,,,,,,,"An update for BayesApp, a web site for analysis of small-angle scattering data, is presented. Most importantly the indirect transformation of data now includes an option for a maximum-entropy constraint in addition to the conventional smoothness constraint. A correction for slit smearing is possible, and options for calculation of the scattering intensity from simple models as well as estimation of structure factors for nonspherical objects have also been added.",http://www.iucr.org/resources/other-directories/software/bayesapp-update
BEAM-ish,,Z,0,0,,,,,,,,,,,,,,,,,,,,,,,,,,,,,,,,,,,,,,,,,,,,,,,,,,,Graphical user interface for processing of multiple superfine &phi;-sliced diffraction images for mosaicity calculation.,http://www.iucr.org/resources/other-directories/software/beam-ish
BenchFFT,,Z,0,0,,,,,,,,,,,,,,,,,,,,,,,,,,,,,,,,,,,,,,,,,,,,,,,,,,,"Benchmark of a large number of publicly-available FFT implementations, both in C and in Fortran, and measures their performance and accuracy over a wide range of transform sizes.",http://www.iucr.org/resources/other-directories/software/benchfft
Better User Group Software,,Z,0,0,,,,,,,,,,,,,,,,,,,,,,,,,,,,,,,,,,,,,,,,,,,,,,,,,,,The main activity of the NOBUGS group has so far been the organization of a series of conferences. The aim of these conferences is to foster collaboration between IT professionals working at X-ray and neutron sources around the world. This collaboration should yield better data acquisition and data analysis software for the users of such facilities. This in turn will increase user productivity and thus maximize the scientific result to be obtained from the large investment required to build and maintain X-ray or Neutron facilities.,http://www.iucr.org/resources/other-directories/software/better-user-group-software
