software,reference,group,score,scoreN,score1,score1N,score2,score2N,score3,score3N,score4,score4N,score5,score5N,1_2_3,1_3_1,1_3,1_5_1,1_5_2,1_6_1,1_6_2,2_1,2_2,2_3,2_4,3_1_1,3_1_2,3_1_3,3_1_4,3_1_5_1,3_1_5_2,3_1_5_3,3_1_5_4,3_2_1,3_2_2,3_2_3,3_2_4,4_1,4_2,4_3_1,4_3_2,4_3_3,4_3_4,4_3_5,5_1,5_2_1,5_2_2,5_2_3,5_2_4,5_3_1,5_3_2,5_3_3,5_4_1,5_4_2,description,link
RETRIEVE,,Z,0,0,,,,,,,,,,,,,,,,,,,,,,,,,,,,,,,,,,,,,,,,,,,,,,,,,,,ICSD interrogation software,http://www.iucr.org/resources/other-directories/software/retrieve
REW,,Z,0,0,,,,,,,,,,,,,,,,,,,,,,,,,,,,,,,,,,,,,,,,,,,,,,,,,,,"For exit-wave reconstruction and experimental high-resolution transmission electron microscopy image alignment. While the exit-wave reconstruction is performed mainly using the maximum-likelihood method, image alignments may be carried out using several algorithms, including the time-consuming but robust genetic algorithm.",http://www.iucr.org/resources/other-directories/software/rew
ReX.Cell,,Z,0,0,,,,,,,,,,,,,,,,,,,,,,,,,,,,,,,,,,,,,,,,,,,,,,,,,,,"ReX.Cell is a multi-platform open-source program aimed at the automation of powder diffraction data indexing, providing an interactive environment and a simple user interface.",http://www.iucr.org/resources/other-directories/software/rex.cell
RIETICA,,Z,0,0,,,,,,,,,,,,,,,,,,,,,,,,,,,,,,,,,,,,,,,,,,,,,,,,,,,"IUCR Web: /comm/cpd/Newsletters/no20summer1998/art15/art15.htmDescription: Rietveld program that allows interaction with the refinement process on a cycle by cycle basis using a graphic interface. The program is derived from the LHPM program which has its origins in the DWBS2.9/3.2 program of Wiles and Young, that in turn is a weak descendant of Rietveld?s original code and Alan Larsons space group code.",http://www.iucr.org/resources/other-directories/software/rietica
Rietveld,,Z,0,0,,,,,,,,,,,,,,,,,,,,,,,,,,,,,,,,,,,,,,,,,,,,,,,,,,,Rietveld programs,http://www.iucr.org/resources/other-directories/software/rietveld
RMC suite,,Z,0,0,,,,,,,,,,,,,,,,,,,,,,,,,,,,,,,,,,,,,,,,,,,,,,,,,,,"Reverse Monte-Carlo modelling. Suite for analysis and modelling of disordered materials - liquids, glasses, amorphous materials, disordered crystals - based on experimental data from neutron diffraction, X-ray diffraction and EXAFS",http://www.iucr.org/resources/other-directories/software/rmc-suite
RMERGE,,Z,0,0,,,,,,,,,,,,,,,,,,,,,,,,,,,,,,,,,,,,,,,,,,,,,,,,,,,Calculates R-Factors to assess quality of X-ray data. A copy of the program is available from Manfred Weiss on request.,http://www.iucr.org/resources/other-directories/software/rmerge
ROCKJOCK,,Z,0,0,,,,,,,,,,,,,,,,,,,,,,,,,,,,,,,,,,,,,,,,,,,,,,,,,,,determines quantitative mineralogy in powdered samples by comparing the integrated X-ray diffraction (XRD) intensities of individual minerals in complex mixtures to the intensities of an internal standard.,http://www.iucr.org/resources/other-directories/software/rockjock
RPS,,Z,0,0,,,,,,,,,,,,,,,,,,,,,,,,,,,,,,,,,,,,,,,,,,,,,,,,,,,"A computing resource (a web server and a database), Repeats in Protein Sequences (RPS), has been created. Using RPS, users can obtain useful information regarding identical, similar and distant repeats in protein sequences, check the frequency of occurrence of the repeats in several sequence databases, and view the three-dimensional structure of the repeats using the Java visualization plug-in Jmol.",http://www.iucr.org/resources/other-directories/software/rps
RSD,,Z,0,0,,,,,,,,,,,,,,,,,,,,,,,,,,,,,,,,,,,,,,,,,,,,,,,,,,,Printing utility for Rietveld data and powder diffraction,http://www.iucr.org/resources/other-directories/software/rsd
RT,,Z,0,0,,,,,,,,,,,,,,,,,,,,,,,,,,,,,,,,,,,,,,,,,,,,,,,,,,,Calculates spatial variation of R-factor statistics.,http://www.iucr.org/resources/other-directories/software/rt
SAAF,,Z,0,0,,,,,,,,,,,,,,,,,,,,,,,,,,,,,,,,,,,,,,,,,,,,,,,,,,,"A tool for analyzing small-angle neutron scattering (SANS) data using analytical model functions. Available also from author on request. The distribution includes the source code, the model library and the user manual.",http://www.iucr.org/resources/other-directories/software/saaf
Sacch3d,,Z,0,0,,,,,,,,,,,,,,,,,,,,,,,,,,,,,,,,,,,,,,,,,,,,,,,,,,,,http://www.iucr.org/resources/other-directories/software/sacch3d
Sadian91,,Z,0,0,,,,,,,,,,,,,,,,,,,,,,,,,,,,,,,,,,,,,,,,,,,,,,,,,,,"Sadian Searches for Atomic DIstances and ANgles in crystal structures. [W.H. Baur &amp; D. Kassner: Sadian90 prepares input for DLS-76 (and does other things as well). <i>Z. Krist. Suppl. Issue</i>,  (1991), <b>3</b>, 15].",http://www.iucr.org/resources/other-directories/software/sadian91
SAL,,Z,0,0,,,,,,,,,,,,,,,,,,,,,,,,,,,,,,,,,,,,,,,,,,,,,,,,,,,"Scientific Applications on Linux references. SAL is copyrighted by Dr. Herng-Jeng Jou and Kachina Technologies, Inc. and it can be freely redistributed under GPL version 2 or later, or otherwise as stated by the owners of the individual files included in SAL.",http://www.iucr.org/resources/other-directories/software/sal
SAM,,Z,0,0,,,,,,,,,,,,,,,,,,,,,,,,,,,,,,,,,,,,,,,,,,,,,,,,,,,Sequence Alignment and Modeling System,http://www.iucr.org/resources/other-directories/software/sam
San Diego Benchmark,,Z,0,0,,,,,,,,,,,,,,,,,,,,,,,,,,,,,,,,,,,,,,,,,,,,,,,,,,,Benchmark for Crystallography by the San Diego Supercomputing Center,http://www.iucr.org/resources/other-directories/software/san-diego-benchmark
SAPI,,Z,0,0,,,,,,,,,,,,,,,,,,,,,,,,,,,,,,,,,,,,,,,,,,,,,,,,,,,Multan-based program package: i Random-starting multisolution direct methods; ii Automatic Patterson analysis for heavy-atom containing structures; iii Combination of Patterson and direct methods; iv Automatic detection and solution of superstructures; v Resoving enantiomorphous phase ambiguity; vi Solving heavy-atom substructures for proteins.,http://www.iucr.org/resources/other-directories/software/sapi
SARA11,,Z,0,0,,,,,,,,,,,,,,,,,,,,,,,,,,,,,,,,,,,,,,,,,,,,,,,,,,,"Refinement of various parameters of III-V and II-VI semiconductors (ZnS) and elemental (diamond) semiconductors. To refine parameters in the harmonic, anharmonic and charge transfer approximations. Refines individual thermal, scale, extinction parameters and the charge transfer from one atom to the other in ZnS type structures. Calculates the real and imaginary phase parts FA and FB of the structure factors. Includes Bijvoet differences in the analysis. Averages the Bijvoet equivalent reflections, etc., etc.",http://www.iucr.org/resources/other-directories/software/sara11
SASdata analysis from biological macromolecules,,Z,0,0,,,,,,,,,,,,,,,,,,,,,,,,,,,,,,,,,,,,,,,,,,,,,,,,,,,"All That SAS - a data analysis program suite freely available to the research community by Dmitri I. Svergun, Michel H.J. Koch, Vladimir V. Volkov, Michael B. Kozin, Marc Malfois, Peter V. Konarev, Maxim V. Petoukhov, Anna V. Sokolova",http://www.iucr.org/resources/other-directories/software/sasdata-analysis-from-biological-macromolecules
SAS-OMEGA,,Z,0,0,,,,,,,,,,,,,,,,,,,,,,,,,,,,,,,,,,,,,,,,,,,,,,,,,,,"Program computes Hauptman's three-phase structure invariant estimate for SAS data [omega = ph(h)+ph(k)+ph(l)]. Program Prequires 6 distinct magnitudes [E(h),E(k),E(l),E(-h),E(-k), E(-l), where h+k+l=0] and chemical composition of the cell",http://www.iucr.org/resources/other-directories/software/sas-omega
SASSIE Contrast Calculator,,Z,0,0,,,,,,,,,,,,,,,,,,,,,,,,,,,,,,,,,,,,,,,,,,,,,,,,,,,"A new software tool,available within the SASSIE software suite, designed to assist in planning small-angle neutron scattering experiments with contrast variation on protein and nucleic acid complexes.",http://www.iucr.org/resources/other-directories/software/sassie-contrast-calculator
SASTBX,,Z,0,0,,,,,,,,,,,,,,,,,,,,,,,,,,,,,,,,,,,,,,,,,,,,,,,,,,,A novel software platform for the analysis of biological small-angle scattering.,http://www.iucr.org/resources/other-directories/software/sastbx
SAXSMorph,,Z,0,0,,,,,,,,,,,,,,,,,,,,,,,,,,,,,,,,,,,,,,,,,,,,,,,,,,,Program to generate three-dimensional representative morphologies of two-phase systems using small-angle X-ray or neutron scattering data. The morphologies thus generated have the correct length scales and degree of connectivity with respect to the sample and are a useful visualization tool. The program also offers statistical analysis of the generated morphology and is user friendly and platform independent.,http://www.iucr.org/resources/other-directories/software/saxsmorph
SCANPS,,Z,0,0,,,,,,,,,,,,,,,,,,,,,,,,,,,,,,,,,,,,,,,,,,,,,,,,,,,protein sequence database scanning using,http://www.iucr.org/resources/other-directories/software/scanps
SCARECROW,,Z,0,0,,,,,,,,,,,,,,,,,,,,,,,,,,,,,,,,,,,,,,,,,,,,,,,,,,,A graphics proram for the analysis and display of molecular dynamics trajectories.,http://www.iucr.org/resources/other-directories/software/scarescrow
SCAT771,,Z,0,0,,,,,,,,,,,,,,,,,,,,,,,,,,,,,,,,,,,,,,,,,,,,,,,,,,,"Having a set of h k l values and powder intensities, apply Lp and multiplicity corrections for any point group, and convert the intensity data into corresponding structure factors. Calculate the structure factors for the supplied set of h k l values, correct the structure factors for anomalous dispersion effects for 10 different wavelengths, calculate the real and imaginary parts of the structure factors, calculate the sin(theta)/lambda values and the atomic scattering factors of all the atoms that you specify in the structure and much more. EExists as GUI version named scat771win.",http://www.iucr.org/resources/other-directories/software/scat771
Scatfac,,Z,0,0,,,,,,,,,,,,,,,,,,,,,,,,,,,,,,,,,,,,,,,,,,,,,,,,,,,X-ray atomic scattering factor display software which can display 1 to 2 elements on the screen. Can also output the data to an ASCII file.,http://www.iucr.org/resources/other-directories/software/scatfac
SDP for Windows,,Z,0,0,,,,,,,,,,,,,,,,,,,,,,,,,,,,,,,,,,,,,,,,,,,,,,,,,,,"Complete crystallographic software package for small molecule structures, including data reduction, structure solution and refinement, calculation of derived parameters, real-time interactive graphics, presentation graphics and preparation of text and tables for publication. Windows 3.1, Windows 95 and Windows 98.",http://www.iucr.org/resources/other-directories/software/sdp-for-windows
SDS,,Z,0,0,,,,,,,,,,,,,,,,,,,,,,,,,,,,,,,,,,,,,,,,,,,,,,,,,,,Ordinary Structure Refinement Program,http://www.iucr.org/resources/other-directories/software/sds
Searchmatch,,Z,0,0,,,,,,,,,,,,,,,,,,,,,,,,,,,,,,,,,,,,,,,,,,,,,,,,,,,"Search match program for use with the International Centre for Diffraction Data's Powder Diffraction File: - powerful search algorithm for multi-phase identification - lightning-fast search using raw data, peak data or a combination of the two - fully integrated Boolean PDF card retrieval and display - user database, with interface to Crystallographica - fully integrated peak search and background subtraction tools - powder pattern simulation, including multi-phase mixtures - reads most common file formats - if not just ask! - writes reports directly to Microsoft Word",http://www.iucr.org/resources/other-directories/software/searchmatch
SEQIO,,Z,0,0,,,,,,,,,,,,,,,,,,,,,,,,,,,,,,,,,,,,,,,,,,,,,,,,,,,"A package for reading and writing sequence files (JR Knight, UC Davis).",http://www.iucr.org/resources/other-directories/software/seqio
SETOR,,Z,0,0,,,,,,,,,,,,,,,,,,,,,,,,,,,,,,,,,,,,,,,,,,,,,,,,,,,High-quality rendering of raster images of macromolecules that can undergo rotation and translation interactively .,http://www.iucr.org/resources/other-directories/software/setor
SEXIE,,Z,0,0,,,,,,,,,,,,,,,,,,,,,,,,,,,,,,,,,,,,,,,,,,,,,,,,,,,Calculation of Coordination Shells and Geometries,http://www.iucr.org/resources/other-directories/software/sexie
SF2CNS,,Z,0,0,,,,,,,,,,,,,,,,,,,,,,,,,,,,,,,,,,,,,,,,,,,,,,,,,,,General purpose program to calculate <i>CNS</i>-formatted maps easily.,http://www.iucr.org/resources/other-directories/software/sf2cns
SFAC331,,Z,0,0,,,,,,,,,,,,,,,,,,,,,,,,,,,,,,,,,,,,,,,,,,,,,,,,,,,For the generation and calculation of the X-ray structure factors and the real and imaginary parts of the structure factors of any crystalline system. Highly useful for beginners in the field. Exists as GUI versions named sfac331win and sfac331_mix for mixed structures.,http://www.iucr.org/resources/other-directories/software/sfac331
SgInfo,,Z,0,0,,,,,,,,,,,,,,,,,,,,,,,,,,,,,,,,,,,,,,,,,,,,,,,,,,,A comprehensive collection of ANSI C routines for the handling of space group symmetry from Switzerland's ETH.,http://www.iucr.org/resources/other-directories/software/sginfo
SHADE,,Z,0,0,,,,,,,,,,,,,,,,,,,,,,,,,,,,,,,,,,,,,,,,,,,,,,,,,,,Estimates anisotropic displacement parameters for hydrogen atoms by combining a rigid-body analysis of the non-hydrogen-atom anisotropic displacement parameters (ADPs) with a contribution from internal atomic motion.,http://www.iucr.org/resources/other-directories/software/shade
SHADOW,,Z,0,0,,,,,,,,,,,,,,,,,,,,,,,,,,,,,,,,,,,,,,,,,,,,,,,,,,,"Powder program. Peak fitting, see CCP14",http://www.iucr.org/resources/other-directories/software/shadow
ShakePSD,,Z,0,0,,,,,,,,,,,,,,,,,,,,,,,,,,,,,,,,,,,,,,,,,,,,,,,,,,,To solve the structures of organic compounds automatically. Can discriminate whether a heavy-atom is included or not and can employ heavy-atom methods (Patterson function and search for all remaining atoms) or direct methods (tangent formula and/or minimal function).,http://www.iucr.org/resources/other-directories/software/shakepsd
Shape_CCMS,,Z,0,0,,,,,,,,,,,,,,,,,,,,,,,,,,,,,,,,,,,,,,,,,,,,,,,,,,,Analysis of structure and chemistry at the molecular surface.,http://www.iucr.org/resources/other-directories/software/shape_ccms
Shark frame grabber,,Z,0,0,,,,,,,,,,,,,,,,,,,,,,,,,,,,,,,,,,,,,,,,,,,,,,,,,,,high quality digitisation of an image or diffraction pattern.,http://www.iucr.org/resources/other-directories/software/shark-frame-grabber
SHARP,,Z,0,0,,,,,,,,,,,,,,,,,,,,,,,,,,,,,,,,,,,,,,,,,,,,,,,,,,,A Statistical Heavy Atom Refinement and Phasing program,http://www.iucr.org/resources/other-directories/software/sharp
SHELX-97,,Z,0,0,,,,,,,,,,,,,,,,,,,,,,,,,,,,,,,,,,,,,,,,,,,,,,,,,,,Set of programs for crystal structure determination from single-crystal diffraction data. Runs on all systems including DOS. See also SHELXS for PC versions.,http://www.iucr.org/resources/other-directories/software/shelx-97
SHELXL2013,,Z,0,0,,,,,,,,,,,,,,,,,,,,,,,,,,,,,,,,,,,,,,,,,,,,,,,,,,,Some of the improvements in SHELX2013 make SHELXL convenient to use for refinement of macromolecular structures against neutron data without the support of X-ray data.,http://www.iucr.org/resources/other-directories/software/shelxl2013
SHELXS,,Z,0,0,,,,,,,,,,,,,,,,,,,,,,,,,,,,,,,,,,,,,,,,,,,,,,,,,,,PC version (DOS and Windows) of the structure solution program SHELXS-86 by G. Sheldrick. Availability is restricted to registered users only. For registration as well as for versions for others systems. see SHELX-97.,http://www.iucr.org/resources/other-directories/software/shelxs
Shift_plot,,Z,0,0,,,,,,,,,,,,,,,,,,,,,,,,,,,,,,,,,,,,,,,,,,,,,,,,,,,Shift_plot may be useful for visual analysis of magnitudes of atomic shifts in refinement.,http://www.iucr.org/resources/other-directories/software/shift_plot
SINGLE,,Z,0,0,,,,,,,,,,,,,,,,,,,,,,,,,,,,,,,,,,,,,,,,,,,,,,,,,,,"SINGLE can be used to control a variety of four-circle Eulerian-cradle single-crystal diffractometers including Hubers, the Stoe Stadi-4 and the Siemens P4.",http://www.iucr.org/resources/other-directories/software/single
Single Crystal,,Z,0,0,,,,,,,,,,,,,,,,,,,,,,,,,,,,,,,,,,,,,,,,,,,,,,,,,,,"To visualize the reciprocal lattice, simulate electron diffraction patterns and display stereographic projections. SingleCrystal reads from CrystalMaker binary files - or loads data directly from CrystalMaker via a menu command. Real-time manipulation and measurement is possible.",http://www.iucr.org/resources/other-directories/software/single-crystal
SIR2002,,Z,0,0,,,,,,,,,,,,,,,,,,,,,,,,,,,,,,,,,,,,,,,,,,,,,,,,,,,<i>Ab initio</i> resolution of macromolecular crystal structures.,http://www.iucr.org/resources/other-directories/software/sir2002
SIR2011,,Z,0,0,,,,,,,,,,,,,,,,,,,,,,,,,,,,,,,,,,,,,,,,,,,,,,,,,,,The successor of SIR2004 and the latest program of the SIR suite.,http://www.iucr.org/resources/other-directories/software/sir2011
SIR97,,Z,0,0,,,,,,,,,,,,,,,,,,,,,,,,,,,,,,,,,,,,,,,,,,,,,,,,,,,Evolution of SIR92. Integrated package of computer programs for the solution and refinement of crystal structures using single crystal data.,http://www.iucr.org/resources/other-directories/software/sir97
SITCOM,,Z,0,0,,,,,,,,,,,,,,,,,,,,,,,,,,,,,,,,,,,,,,,,,,,,,,,,,,,Facilitates the comparison of macromolecular substructures from different sources for validation purposes and to construct a consensus model containing sites from different substructures.,http://www.iucr.org/resources/other-directories/software/sitcom
Situs,,Z,0,0,,,,,,,,,,,,,,,,,,,,,,,,,,,,,,,,,,,,,,,,,,,,,,,,,,,"Program package for the docking of protein crystal structures to single-molecule, low-resolution maps from electron microscopy. Developed to provide a robust and quantitative method for the localization of biomolecular subunits in low-resolution data. Use of single-molecule density maps that can be obtained by subtraction of maps from specimens of variable subunit composition. The central algorithm is a topology-representing neural network to correlate features within the structural data sets.",http://www.iucr.org/resources/other-directories/software/situs
SnB,,Z,0,0,,,,,,,,,,,,,,,,,,,,,,,,,,,,,,,,,,,,,,,,,,,,,,,,,,,"Based on Shake-and-Bake, a dual-space direct methods procedure for determining crystal structures from X-ray diffraction data.",http://www.iucr.org/resources/other-directories/software/snb
SOWOS,,Z,0,0,,,,,,,,,,,,,,,,,,,,,,,,,,,,,,,,,,,,,,,,,,,,,,,,,,,Program for the determination of the Wulff construction starting solely from the directions of the bounding facets.,http://www.iucr.org/resources/other-directories/software/sowos
Space Group Explorer,,Z,0,0,,,,,,,,,,,,,,,,,,,,,,,,,,,,,,,,,,,,,,,,,,,,,,,,,,,"Gives you immediate access to much of the information which is available in the International Tables for Electron Crystallography, on-line in your own PC.",http://www.iucr.org/resources/other-directories/software/space-group-explorer
SPACER,,Z,0,0,,,,,,,,,,,,,,,,,,,,,,,,,,,,,,,,,,,,,,,,,,,,,,,,,,,A program to display space-group information for a conventional and nonconventional coordinate system,http://www.iucr.org/resources/other-directories/software/spacer
SPASM,,Z,0,0,,,,,,,,,,,,,,,,,,,,,,,,,,,,,,,,,,,,,,,,,,,,,,,,,,,Tool for pattern recognition in protein structures at the level of assemblies of individual residues. See DEJAVU for the same at the level of fold.,http://www.iucr.org/resources/other-directories/software/spasm
SPE,,Z,0,0,,,,,,,,,,,,,,,,,,,,,,,,,,,,,,,,,,,,,,,,,,,,,,,,,,,"Space Group Explorer (SPE) for Windows. Gives you immediate access to much of the information which is available in the International Tables for Electron Crystallography, on-line in your own PC.",http://www.iucr.org/resources/other-directories/software/spe
SPEC,,Z,0,0,,,,,,,,,,,,,,,,,,,,,,,,,,,,,,,,,,,,,,,,,,,,,,,,,,,"tools for acquiring, analyzing and plotting data",http://www.iucr.org/resources/other-directories/software/spec
SPGR4D,,Z,0,0,,,,,,,,,,,,,,,,,,,,,,,,,,,,,,,,,,,,,,,,,,,,,,,,,,,Computer program to derive (3 1)-dimensional symmetry operations from two-line symbols.,http://www.iucr.org/resources/other-directories/software/spgr4d
SR5,,Z,0,0,,,,,,,,,,,,,,,,,,,,,,,,,,,,,,,,,,,,,,,,,,,,,,,,,,,"Rietveld program by Rod Hill and Ian Madsen (Ian.Madsen@csiro.au) of CSIRO Division of Minerals, Melbourne, Australia",http://www.iucr.org/resources/other-directories/software/sr5
SrRietveld,,Z,0,0,,,,,,,,,,,,,,,,,,,,,,,,,,,,,,,,,,,,,,,,,,,,,,,,,,,"SrRietveld extends and automates the popular existing Rietveld programs FullProf and GSAS to facilitate studies that involve many refinements, such as the analysis of large numbers of data sets.doi:10.1107/S0021889812045967/db5090sup1.zip   (windows)doi:10.1107/S0021889812045967/db5090sup2.tar.gz (Linux, Unix or Mac)",http://www.iucr.org/resources/other-directories/software/srrietveld
SSM,,Z,0,0,,,,,,,,,,,,,,,,,,,,,,,,,,,,,,,,,,,,,,,,,,,,,,,,,,,"Interactive service for comparing protein structures in 3D. Allows for: comparison of two structures, examination of a structure for similarity with the whole PDB or SCOP archives, best Ca-alignment of compared structures, download and visualization of best-superposed structures using RasMol (Unix/Linux platforms) or RasTop (MS Windows machines), linking the results to other services - OCA, SCOP, GeneCensus, FSSP, 3Dee, CATH, PDBSum, SWISS-PROT and ProtoMap. SSM (Secondary Structure Matching) on homepage for PDBe Fold.",http://www.iucr.org/resources/other-directories/software/ssm
STAMP,,Z,0,0,,,,,,,,,,,,,,,,,,,,,,,,,,,,,,,,,,,,,,,,,,,,,,,,,,,Alignment and analysis of protein 3-D structures.,http://www.iucr.org/resources/other-directories/software/stamp
STNET,,Z,0,0,,,,,,,,,,,,,,,,,,,,,,,,,,,,,,,,,,,,,,,,,,,,,,,,,,,Drawing of Wulf nets. Part of the CCP4 suite,http://www.iucr.org/resources/other-directories/software/stnet
STRATEGY,,Z,0,0,,,,,,,,,,,,,,,,,,,,,,,,,,,,,,,,,,,,,,,,,,,,,,,,,,,"Program to aid in data collection strategy. You can run it after indexing the first frame using DENZO. Given the space group, it determines the spindle angle to start the data collection at.",http://www.iucr.org/resources/other-directories/software/strategy
Structure Tidy,,Z,0,0,,,,,,,,,,,,,,,,,,,,,,,,,,,,,,,,,,,,,,,,,,,,,,,,,,,"Puts crystal structures into standardized co-ordinates for comparison with other structures (to check if identical or isotypic). Available within Ton Spek's Platon (since Dec 2004). Parthe, E. &amp; Gelato, L. M. (1984). <i>Acta Cryst.</i> A<b>40</b>, 169&ndash;183; Hu, S.-Z. &amp; Parthe, E. (2004). <i>Chin. J. Struct. Chem.</i> <b>23</b>, 1150&ndash;1160.",http://www.iucr.org/resources/other-directories/software/structure-tidy2
SUBGROUPGRAPH,,Z,0,0,,,,,,,,,,,,,,,,,,,,,,,,,,,,,,,,,,,,,,,,,,,,,,,,,,,Analysis of group-subgroup relations between space groups. Available both as stand alone program or through a Web interface.,http://www.iucr.org/resources/other-directories/software/subgroupgraph
Suites_for_small_molecules,,Z,0,0,,,,,,,,,,,,,,,,,,,,,,,,,,,,,,,,,,,,,,,,,,,,,,,,,,,Review on suites of programs for small molecules,http://www.iucr.org/resources/other-directories/software/suites_for_small_molecules
SUPERFLIP,,Z,0,0,,,,,,,,,,,,,,,,,,,,,,,,,,,,,,,,,,,,,,,,,,,,,,,,,,,"Solve crystal structures from diffraction data using the recently developed charge-flipping algorithm. It can solve periodic structures, incommensurately modulated structures and quasicrystals from X-ray and neutron diffraction data.",http://www.iucr.org/resources/other-directories/software/superflip
SURFNET,,Z,0,0,,,,,,,,,,,,,,,,,,,,,,,,,,,,,,,,,,,,,,,,,,,,,,,,,,,Generates surfaces and void regions between surfaces from coordinate data supplied in a PDB file.,http://www.iucr.org/resources/other-directories/software/surfnet
Swiss-PdbViewer,,Z,0,0,,,,,,,,,,,,,,,,,,,,,,,,,,,,,,,,,,,,,,,,,,,,,,,,,,,Macintosh application that provides a user friendly interface allowing analysis of several proteins at the same time.,http://www.iucr.org/resources/other-directories/software/swiss-pdbviewer
SYMMOL,,Z,0,0,,,,,,,,,,,,,,,,,,,,,,,,,,,,,,,,,,,,,,,,,,,,,,,,,,,"Symmetrizes a group of atoms whose coordinates, either orthogonal or oblique, are given in input. It prints out information about the given set of atoms and information concerning its symmetry: the symmetrized orthogonal coordinates together the point group (PG), the labels and the equivalent positions. Some quantities showing the goodness-of-fit are also printed: the rms on the coordinates, the molecular rms, the maximum deviation of the coordinates of the atom from the symmetrized ones and the continuous symmetry measure (CSM) for the whole PG and for the single elements of the PG.",http://www.iucr.org/resources/other-directories/software/symmol
TER_SL,,Z,0,0,,,,,,,,,,,,,,,,,,,,,,,,,,,,,,,,,,,,,,,,,,,,,,,,,,,"Calculates x-ray specular reflection from multilayers at grazing incidence. It can account for small interface roughness using Nevot and Croce's method, and the high rms roughness can be simulated with transition layers.",http://www.iucr.org/resources/other-directories/software/ter_sl
TESTSYM,,Z,0,0,,,,,,,,,,,,,,,,,,,,,,,,,,,,,,,,,,,,,,,,,,,,,,,,,,,"cell symetry checking, see CCP14.",http://www.iucr.org/resources/other-directories/software/testsym
TeXsan,,Z,0,0,,,,,,,,,,,,,,,,,,,,,,,,,,,,,,,,,,,,,,,,,,,,,,,,,,,"From data processing to structure solution, modeling, refinement",http://www.iucr.org/resources/other-directories/software/texsan
TOP,,Z,0,0,,,,,,,,,,,,,,,,,,,,,,,,,,,,,,,,,,,,,,,,,,,,,,,,,,,Protein TOPological comparison program which detects whether there are structural similarities between two proteins.,http://www.iucr.org/resources/other-directories/software/top
TOPAS-Academic,,Z,0,0,,,,,,,,,,,,,,,,,,,,,,,,,,,,,,,,,,,,,,,,,,,,,,,,,,,General non-linear least squares system driven by a scripting language. Applied to solid state chemistry and optimization. Contains minimization routines wrapped by a computer algebra system; it is this foundation that makes subject dependent modules such as Rietveld refinement shine. Academic version of BRUKER-AXS TOPAS.,http://www.iucr.org/resources/other-directories/software/topas-academic
TOPOS,,Z,0,0,,,,,,,,,,,,,,,,,,,,,,,,,,,,,,,,,,,,,,,,,,,,,,,,,,,Package for calculation of geometrical and topological properties of crystal structures.,http://www.iucr.org/resources/other-directories/software/topos
